<?xml version="1.0" encoding="UTF-8"?>
<xs:schema xmlns:xs="http://www.w3.org/2001/XMLSchema">
	<xs:element name="list">
		<xs:complexType>
			<xs:sequence minOccurs="1" maxOccurs="2">
				<xs:element name="newbieBuff" minOccurs="1" maxOccurs="136">
					<xs:complexType>
						<xs:attribute name="activated" type="xs:boolean" use="required" />
					</xs:complexType>
				</xs:element>
				<xs:element name="class" minOccurs="1" maxOccurs="136">
					<xs:complexType>
						<xs:sequence minOccurs="1" maxOccurs="1">
							<xs:element name="buff" minOccurs="1" maxOccurs="unbounded">
								<xs:complexType>
									<xs:attribute name="id" type="xs:positiveInteger" use="required" />
									<xs:attribute name="lvl" type="xs:positiveInteger" />
									<xs:attribute name="time" type="xs:integer" />
								</xs:complexType>
							</xs:element>
						</xs:sequence>
						<xs:attribute name="classId">
							<xs:simpleType>
								<xs:restriction base="xs:nonNegativeInteger">
									<xs:minInclusive value="0" />
									<xs:maxInclusive value="136" />
								</xs:restriction>
							</xs:simpleType>
						</xs:attribute>
					</xs:complexType>
				</xs:element>
			</xs:sequence>
		</xs:complexType>
	</xs:element>
</xs:schema>